<?xml version="1.0" encoding="UTF-8" ?>
<xs:schema xmlns:xs="http://www.w3.org/2001/XMLSchema">

    <xs:element name="libraryOrder">
        <xs:complexType>
            <xs:sequence>
                <xs:element name="orderperson" type="xs:string"/>
                <xs:element name="library">
                    <xs:complexType>
                        <xs:sequence>
                            <xs:element name="name" type="xs:string"/>
                            <xs:element name="address" type="xs:string"/>
                            <xs:element name="city" type="xs:string"/>
                            <xs:element name="country" type="xs:string"/>
                        </xs:sequence>
                    </xs:complexType>
                </xs:element>
                <xs:element name="book" maxOccurs="unbounded">
                    <xs:complexType>
                        <xs:sequence>
                            <xs:element name="title" type="xs:string"/>
                            <xs:element name="author" type="xs:string"/>
                            <xs:element name="isbn" type="xs:string"/>
                            <xs:element name="quantity" type="xs:positiveInteger"/>
                            <xs:element name="price" type="xs:decimal"/>
                        </xs:sequence>
                    </xs:complexType>
                </xs:element>
            </xs:sequence>
            <xs:attribute name="orderid" type="xs:string" use="required"/>
        </xs:complexType>
    </xs:element>

</xs:schema>
